{
  "$schema": "./provenance.schema.json",
  "schema_version": 1,
  "runner": "scripts/run_local.sh",
  "model": "local-synthetic (no GitHub Models)",
  "generated_by": "run_local.sh",
  "run_environment": "local",
  "commit": "b5d58fbc92a9145abcfea1c3b03134db5f695181",
  "tool_call": {
    "mode": "synthetic",
    "generated_by": "scripts/mcp_call.mjs"
  },
  "kernel": {
    "sha256": "0b5e792500592b56847f70b1e27e47aecdc65023c7c59fd79695102c465f26ec"
  },
  "bundle": {
    "path": "pwa/bundle.json",
    "sha256": "7d16775e7ee271bf6563c7ac9988bf270cff1ce4be1ff2ddfd8250544a267226"
  },
  "request": {
    "sha256": "d4d7b5613cdb6abf0676daaa837de8aec1efd70940ed3feea4dee786857e1204"
  },
  "historical_capture": {
    "model": "openai/gpt-4o-mini",
    "kernel_sha256": "d3067bc07e74977dedf6bb96d79a710c4b61143f6e8db151655bc88ece8b9d66",
    "request_sha256": "e5b872c7e5c7fa94e901a3c7d642cc830157e339585aad24c2cceb761e759a02",
    "bundle_path": "archive/bundle-d3067bc0-historical.json",
    "runner": ".github/workflows/demo.yml",
    "run_environment": "github-actions",
    "tool_call_mode": "live"
  }
}
